amount,club,rnd,state
23986,"Canberra Bmx Club, Inc.",1,ACT
2840,Canberra Dragon Boat Association Inc,1,ACT
10531,Reid Tennis Club,1,ACT
200000,Woden Valley Gymnastics,1,ACT
20563,Arawang Netball Association,2,ACT
454430,Canberra Netball Association,2,ACT
140000,South Canberra Gymnastics Club,2,ACT
10530,Southlands Tennis Club,2,ACT
198960,Act And Southern New South Wales Rugby Union Brumbies Ltd,3,ACT
50000,Molonglo Juggernauts Australian Rules Football Club,3,ACT
47996,Riding For The Disabled Of The Act Inc (Pegasus),3,ACT
215569,University Of Canberra Union (Ucu),3,ACT
200000,Woden Valley Gymnastics,3,ACT
60000,Alexander Park Dressage Club Inc,1,NSW
60000,Ballina Tennis Club Inc.,1,NSW
197000,Bar Beach Tennis Club Incorporation,1,NSW
125000,Beecroft Rugby Club Incorporated,1,NSW
170620,Churches Football Association Sydney Inc,1,NSW
15075,Cumberland Council,1,NSW
50000,Eastwood Ryde Netball Association Inc.,1,NSW
200000,Eurobodalla Shire Council,1,NSW
43000,Evans Head Bombers Rugby League Football Club,1,NSW
154300,Football South Coast Limited,1,NSW
178335,Forbes Shire Council,1,NSW
377587,Goulburn Mulwaree Council,1,NSW
24500,Goulburn Railway Tennis Club Inc,1,NSW
178856,Grafton Sporting Car Club Inc.,1,NSW
25000,Harwood Cricket Club,1,NSW
100000,Hawkesbury Sports Council Inc.,1,NSW
27270,Highlands District Cricket Association Inc,1,NSW
50000,Kemps Creek United Soccer Club,1,NSW
50000,La Perouse Local Aboriginal Land Council,1,NSW
200000,Lilli Pilli Football Club Inc,1,NSW
2400,Lindfield Tennis Club,1,NSW
500000,Maitland Rugby Union Football Club Inc.,1,NSW
144936,Mangoplah Cookardinia United Eastlakes Football And Netball Club,1,NSW
20000,Moruya Tennis Club - Under Auspices Of Moruya Bowling And Recreation Club,1,NSW
455471,Mungindi Junior Rugby League Inc,1,NSW
4260,Muswellbrook Little Athletics Centre Incorporated,1,NSW
178379,Nambucca Shire Council,1,NSW
75000,Northbridge Sailing Club Ltd,1,NSW
170000,Northern Beaches Council,1,NSW
25000,Northern Storm Football And Sports Club,1,NSW
50000,Nsw Biathlon Association,1,NSW
50000,Penrith City Council,1,NSW
200000,Penrith City Council,1,NSW
104624,Police Citizens Youth Club Nsw Ltd (Pcyc Lake Macquarie),1,NSW
134210,Police Citizens Youth Clubs Nsw Ltd (Singleton),1,NSW
70000,Queenscliff Surf Life Saving Club Ltd,1,NSW
38629,Scone Gymnastics Club Incorporated,1,NSW
80279,Shoalhaven District Football Association,1,NSW
20000,Shoalhaven Heads Chamber Of Commerce & Tourism Inc,1,NSW
20503,South East Junior Oztag Association,1,NSW
119660,Southern Ettalong Football Club,1,NSW
200000,St. George Rowing Club,1,NSW
500000,St. George Football Association,1,NSW
95821,Sydney Bmx Club,1,NSW
40000,Tamworth Junior Riding And Pony Club Inc,1,NSW
5245,The Scout Association Of Australia Nsw Branch,1,NSW
27708,Tweed Shire Council,1,NSW
45000,Vaucluse Amateur 12' Sailing Club Inc,1,NSW
39700,Wakehurst Tennis,1,NSW
480000,Wallerawang Bowling Club,1,NSW
46186,Weethalle Recreation Ground Committee,1,NSW
15695,Werris Creek Golf Club Ltd.,1,NSW
48000,Willow Tree Bowling Club,1,NSW
50000,Wollongong Wolves Football Club Ltd,1,NSW
70000,Woollahra Municipal Council,1,NSW
500000,Yass Valley Council,1,NSW
50000,Armidale Tennis Club Inc,2,NSW
50000,Bathurst Regional Council,2,NSW
50000,Black Range Pony Club,2,NSW
180000,Blacktown City Council,2,NSW
175000,Blue Mountains City Council,2,NSW
26000,Blue Mountains District Rugby Football Club,2,NSW
19900,Blue Mountains District Rugby Football Club,2,NSW
55455,Bowral Rugby Club,2,NSW
125000,Bradman Foundation,2,NSW
330321,Burwood Council,2,NSW
150000,Central Coast Council,2,NSW
485000,Central Coast Council,2,NSW
105500,Charity Bounce,2,NSW
127489,Charlestown District Cricket Club,2,NSW
500000,Clarence Valley Council,2,NSW
400000,Coffs Harbour City Council,2,NSW
117396,East Molong Tennis Club,2,NSW
184000,Eastwood Thornleigh District Tennis Association,2,NSW
15840,Gloucester District Tennis Association,2,NSW
30000,Helensburgh Horse And Pony Club,2,NSW
50000,Howlong Pony Club,2,NSW
191670,Hume Tennis Club,2,NSW
500000,Inner West Council,2,NSW
40000,Kootingal And District Pony Club,2,NSW
75000,Liverpool Golf Club Ltd,2,NSW
100000,Maryland Fletcher Football Club Inc,2,NSW
125500,Medowie Netball Club C/O Medowie Sports Council,2,NSW
173441,Merriwagga Racecourse And Recreation Reserve Land Manager,2,NSW
50000,Mollymook Outrigger Canoe Club,2,NSW
11599,Moorebank Sports Club,2,NSW
105000,Moruya Golf Club,2,NSW
200000,Mullimbimby Brunswick Valley Football Club,2,NSW
135500,North Sydney Council,2,NSW
500000,Northern Sydney And Beaches Hockey Association,2,NSW
47339,Oberon Golf Club,2,NSW
25000,Parkes Tennis Club Inc,2,NSW
100000,Parramatta City Tennis Incorporated,2,NSW
500000,Penrith City Council,2,NSW
200000,Pitt Town And District Sports Soccer Club And Pitt Town Bowls Club,2,NSW
48070,Police Citizens Youth Clubs Nsw Ltd (Albury),2,NSW
146899,Rawsonville Pony Club,2,NSW
9405,Rich River Golf Club,2,NSW
62467,Shoalhaven City Council,2,NSW
196300,Singleton Council,2,NSW
20000,Southern Cross Gliding Club,2,NSW
200000,Southern Cross Gliding Club,2,NSW
188500,St Anthony And St Pauls,2,NSW
39000,Taree Basketball Association Inc,2,NSW
17000,Temora Rugby Union Club,2,NSW
78000,Temora Town Netball Association,2,NSW
45000,Tenterfield Bowls Club,2,NSW
53000,Wakehurst Rugby League Club Ltd,2,NSW
31500,Wellington Bowling Club,2,NSW
10655,West Wyalong Amateur Swimming Club,2,NSW
18000,Wollongong Cardinals Baseball Club,2,NSW
47280,Adelong Service Citizens And Bowling Club,3,NSW
250000,Albury City Council,3,NSW
190000,Armidale Regional Council,3,NSW
200000,Bathurst Regional Council,3,NSW
140372,Bayview Golf Club,3,NSW
75499,Breeza Progress Association Incorporated,3,NSW
174970,Broken Hill Basketball Association,3,NSW
50000,Burrumbuttock Tennis Club,3,NSW
230000,Byron Bay Cycle Club Inc (Bbcc),3,NSW
145000,Candelo Campdraft Association,3,NSW
360000,Canterbury Bankstown Tennis Association Inc.,3,NSW
350000,Canterbury-Bankstown Council,3,NSW
150000,Central Coast Council,3,NSW
42000,Coolamatong Snowy Mountains Country Club Limited,3,NSW
20000,Cumberland Council,3,NSW
32220,Dunoon United Football Club,3,NSW
35000,Eastern Suburbs Leagues Club Pty Ltd - Kingswood Sports Club,3,NSW
475000,Eurobodalla Shire Council,3,NSW
169098,Fairfield City Council,3,NSW
371000,Football Nsw,3,NSW
100000,Forest Rangers Football Club Incorporated,3,NSW
23350,Goulburn Rodeo Club Inc,3,NSW
15000,Guyra Gun Club,3,NSW
195800,Gwydir Shire Council,3,NSW
200000,Hawkesbury District Agricultural Association,3,NSW
200000,Hockey Coffs Coast Inc,3,NSW
500000,Hunters Hill Rugby Union Football Club,3,NSW
42000,Jamberoo Rugby League Football Club,3,NSW
142000,Kingscliff Tennis Club Inc,3,NSW
110265,Kooloora Community Centre,3,NSW
16500,Kurri Kurri Tennis Club Incorporated,3,NSW
24720,Kyogle Golf Club Ltd,3,NSW
45000,Lake Macquarie Dockers Afl Club,3,NSW
200000,Lismore Tennis Club Inc,3,NSW
200000,Merewether Carlton Rugby Union Club,3,NSW
50000,Moorebank Sports Soccer Club,3,NSW
500000,Mosman Rowing Club,3,NSW
91220,Mt Annan Football Club,3,NSW
19425,Muswellbrook And District Junior Rugby League Football Club,3,NSW
15000,Nepean Football Club,3,NSW
57326,Newcastle District Tennis Association,3,NSW
160000,Northern Beaches Council,3,NSW
60642,Paramount Tennis Club Inc.,3,NSW
500000,Pennant Hills Afl Club,3,NSW
50000,Penrith City Council,3,NSW
50000,Penrith City Council,3,NSW
49000,Penrith District Netball Association,3,NSW
496214,Port Stephens Council,3,NSW
10828,Portland Golf Club Ltd,3,NSW
50000,Queanbeyan District Cricket Club Incorporated,3,NSW
190000,Randwick City Council,3,NSW
50000,Sans Souci Football Club Inc,3,NSW
21042,Sawtell Bowling And Recreation Club Ltd,3,NSW
137530,Sawtell/ Toormina Australian Football Club Inc,3,NSW
80000,Shellharbour City Council,3,NSW
115634,Shelly Beach Golf Club,3,NSW
488399,Southern Ettalong Football Club,3,NSW
195000,Southern Highlands Hockey Centre Committee,3,NSW
42500,St George Amd Sutherland Shire Giants Baseball Club Incorporated,3,NSW
48647,St Peter And St Paul Coptic Orthodox Church,3,NSW
25000,Tilligerry Community Association,3,NSW
33000,Urunga Cricket Club Incorporated,3,NSW
5000,Vaucluse Amateur 12' Sailing Club Inc,3,NSW
450000,Wagga Wagga And District Amateur Football Association Incorporated,3,NSW
14533,Wellington Golf Club Ltd,3,NSW
40000,City Of Palmerston,1,NT
131099,Macdonnell Regional Council,1,NT
500000,Northern Territory Cricket Association,1,NT
153233,West Daly Regional Council,1,NT
102251,Alice Springs Baseball Association,2,NT
493056,Darwin Basketball Association,2,NT
200000,Katherine Town Council,2,NT
239050,Nhulunbuy Bmx Club Inc,2,NT
303682,Alice Springs Indian Community Cricket Club (Alice Tigers) Inc.,3,NT
500000,Nt Field And Game Association Inc,3,NT
191550,West Daly Regional Council,3,NT
500000,Brothers Rugby Club Inc,1,QLD
21929,Bundaberg And District Table Tennis Association Inc,1,QLD
102343,Bundaberg Golf Club Inc,1,QLD
312918,Cahill Park Sports Complex Incorporated,1,QLD
36900,Caloundra Rugby Union Club Incorporated,1,QLD
437400,Camp Hill Carina Welfare Association,1,QLD
98151,Carindale Districts Junior Australian Football Club Inc.,1,QLD
38500,Concise Equestrian Centre,1,QLD
337000,Edge Hill United Football Club Inc,1,QLD
48199,Freestone State School Parents And Citizens Association,1,QLD
154000,Getting Kids Active Inc,1,QLD
184500,Gracemere Sports Club,1,QLD
50000,Gulf Christian College,1,QLD
50000,Help Enterprises Limited,1,QLD
33000,Ipswich Basketball Association Inc,1,QLD
159990,Kandanga Tennis Club Inc.,1,QLD
45000,Kilcoy Golf Club Inc,1,QLD
146284,Kumbia Tennis Association Inc,1,QLD
500000,Mackay Hockey Association,1,QLD
157400,Maroochydore Rugby Union Club Incorporated,1,QLD
137900,Mckinlay Shire Council,1,QLD
60113,Mooloolaba Bowls Club Inc,1,QLD
21000,Moranbah Tennis Association Inc,1,QLD
66036,Mundubbera Horse & Pony Club Inc,1,QLD
30000,Musgrave Hill Bowls Club Inc.,1,QLD
23800,Noosa District Softball Association Inc,1,QLD
362440,North Queensland Football Limited,1,QLD
65800,North Toowoomba Bowls Club Inc,1,QLD
500000,Ormeau Junior Rugby League Football Club Inc,1,QLD
451900,Peninsula And Districts Football And Sporting Club Incorporated,1,QLD
200000,Pine River Rowing Club,1,QLD
184382,Redlands Cricket Inc.,1,QLD
228869,Rockhampton Basketball Incorporated,1,QLD
300000,Sandgate Hawks Sporting Club,1,QLD
122161,Souths Rugby Union Club Inc,1,QLD
160870,"St Patrick'S Catholic School, Winton",1,QLD
6369,Suncoast Hinterland Bmx Club,1,QLD
50000,Wellington Point Bowls Club Inc.,1,QLD
30000,Widgee District Hall And Recreation Association Inc.,1,QLD
88462,Wolston Park Centenary Cricket Club Inc.,1,QLD
500000,Bardon Latrobe Football Club Inc.,2,QLD
13000,Brisbane Rugby League Referees Association Inc,2,QLD
48000,Burdekin Shire Council,2,QLD
110000,Cairns District Junior Rugby League Ltd,2,QLD
199999,Callide United Football Club,2,QLD
330000,Capricorn Coast Netball Association,2,QLD
194797,Dolphins Football Club,2,QLD
99817,Edmonton Storm Seniors Rugby League Club,2,QLD
190000,Football Queensland South West Ltd,2,QLD
30000,Gladstone District Dirtriders Club Inc,2,QLD
96800,Gold Coast Albert Junior Tennis Club,2,QLD
150000,Gold Coast City Council,2,QLD
149500,Hervey Bay And District Tennis Association,2,QLD
112820,Holland Park Hawks Football Club Inc,2,QLD
33932,Home Hill Tennis Association,2,QLD
500000,Ipswich City Council,2,QLD
280732,Jimboomba Branch Little Athletics,2,QLD
141442,Jimboomba Netball Association Inc.,2,QLD
264618,Logan Basketball Inc,2,QLD
50000,Malanda Horse And Pony Club,2,QLD
200000,Maleny Golf Club Inc,2,QLD
150000,Maroochydore Football Club Incorporated,2,QLD
426300,Maryborough And District Hockey Association,2,QLD
89496,Middlemount Golf & Country Club,2,QLD
199712,Moreton Bay United Football Club,2,QLD
398497,Mount Isa Amatuer Netball Association Incorporation,2,QLD
14788,Mount Petrie Bowmen Inc,2,QLD
187686,Mt Gravatt Australian Rules Football Club,2,QLD
150395,North Brisbane Fc,2,QLD
187700,Northern Beaches United Football Club,2,QLD
369991,Palm Island Aboriginal Shire Council,2,QLD
50000,Pioneer Tennis Inc,2,QLD
16400,Rochedale Rovers Fc Inc,2,QLD
22000,Slade Point Rugby Club,2,QLD
317923,Squash Aystralia Pty Ltd.,2,QLD
160000,St Catherine'S United Football Club Inc,2,QLD
160531,Surfers Paradise Golf Club Limited,2,QLD
4431,Taroom Pony Club,2,QLD
149800,Tennis Gold Coast Inc,2,QLD
484783,Victoria Point Sharks Sporting Club,2,QLD
318893,Warwick And District Netball Association,2,QLD
180514,Wide Bay Gymnastics Club Incorporated,2,QLD
7000,Artworks Granite Belt,3,QLD
56820,Ballinger Park Tennis Club,3,QLD
14556,Beaudesert Bowls Club Inc,3,QLD
50000,Beenleigh Multisports Association,3,QLD
195000,Beenleigh Multisports Association,3,QLD
458994,Bundaberg Rowing Club,3,QLD
500000,Caboolture Sports Club Limited,3,QLD
418500,Cairns Cycling Club,3,QLD
50000,Chinchilla Squash Club Inc.,3,QLD
80000,Gayndah Swimming Club Inc,3,QLD
500000,Grange Thistle Soccer Club,3,QLD
181000,Granville Hockey Club Inc.,3,QLD
50000,Ipswich Basketball Association Inc,3,QLD
200000,Jandowae And District Tennis Association Incorporated,3,QLD
16000,Kandanga Country Club Inc,3,QLD
50000,Lockyer Valley Regional Council,3,QLD
46897,Lowood And District Memorial Bowls Club Inc,3,QLD
491260,Mackay Brothers Football Club Inc,3,QLD
151868,Maroochydore Tennis Club,3,QLD
45000,Mountain Creek Mooloolaba Swimming Club,3,QLD
199982,North Star Football Association Inc.,3,QLD
27000,Pine Central Holy Spirit Rugby League Football Club Inc,3,QLD
50000,Pomona Bowls Club,3,QLD
101584,Queens Cricket Club Incorporated,3,QLD
92334,Redlands United Football Club,3,QLD
420000,Somerset Regional Council,3,QLD
44840,South Western Metro Basketball Inc,3,QLD
135949,Sunnybank Saints Soccer Club Inc,3,QLD
500000,Sunshine Coast Regional Council,3,QLD
66885,Tamborine Pony Club Inc.,3,QLD
500000,The Redcliffe District Rugby League Football Club Incorporated,3,QLD
387400,Toowong Football Club Inc.,3,QLD
497000,Townsville Basketball Inc,3,QLD
96966,Tweed Heads And Coolangatta Surf Lifesaving Club,3,QLD
146200,Yeppoon Swans Afl Club,3,QLD
45870,Baptist Care (Sa) Incorporated,1,SA
456140,Blackwood Football Club Incorporated,1,SA
250000,City Of Port Adelaide Enfield,1,SA
500000,City Of Tea Tree Gully,1,SA
50000,Clare Motorcycle Club Inc,1,SA
22182,Crystal Brook Junior Basketball Club Inc,1,SA
18200,Glenelg District Cricket Club,1,SA
50000,Greenock Cricket Club,1,SA
12500,Hahndorf Bowling Club Inc,1,SA
500000,Hectorville Sports And Community Club,1,SA
422420,Kadina Hockey Club Incorporated,1,SA
50000,Peake Gardens Riverside Tennis Club,1,SA
500000,Renmark Paringa Council,1,SA
48000,Rsmu Netball Club,1,SA
500000,South Australian Cricket Association Limited,1,SA
171511,South Australian National Football League Inc (Sanfl),1,SA
8342,Sunnybrae Pony Club Incorporated,1,SA
30000,The Cove Bmx Club Incorporated,1,SA
50000,The Royal Adelaide Golf Club,1,SA
115000,Victor Harbor Football Club Inc.,1,SA
8000,Wheelchair Sports Association Of South Australia Inc.,1,SA
154011,Burnside Lacrosse Club Incorporated,2,SA
320200,City Of Playford,2,SA
151600,City Of Prospect,2,SA
396466,Corporation Of The City Of Marion,2,SA
200000,Glenunga Tennis Club Inc,2,SA
124000,Goodwood Saints Football Club,2,SA
45000,Lock And Districts Swimming Centre,2,SA
40000,Millicent Football Netball Club Inc,2,SA
50000,Mount Crawford Dressage Club Incorporated,2,SA
35000,Murray Bridge Lawn Tennis Association Inc,2,SA
80000,Naracoorte United Soccer Club,2,SA
43000,Parndana Sports Club Inc.,2,SA
2500,Perponda Sports Club,2,SA
78800,Port Adelaide District Baseball Club,2,SA
14524,Port Macdonnell And District Bowling Club Inc,2,SA
47689,Sa Field And Game Association - Southern Branch,2,SA
65000,Semaphore Bowling Club,2,SA
385000,Sturt District Cricket Club Inc (Sdcc),2,SA
200000,Sturt Lions Football Club,2,SA
400000,Willunga Recreation Park Incorporated (Wrpi),2,SA
113148,Wirrabara Sporting Reserve Committee,2,SA
7000,Wudinna Tennis Club,2,SA
127373,Yankalilla Bowling Club Inc.,2,SA
499199,Adelaide Hills Council,3,SA
372537,Bellevue Heights Tennis Club Incorporated,3,SA
200000,Blackfriars Old Scholars Football Club,3,SA
480000,Eudunda Sporting Club Inc.,3,SA
84000,Football Federation Sa Inc,3,SA
382200,Henley Football Club Incoorporated,3,SA
266000,Kalangadoo War Memorial Park And Community Sports Club Inc,3,SA
40550,North Eastern Sports Shooting Club Inc.,3,SA
213387,North Mount Gambier Football Club Inc,3,SA
500000,Old Collegians Rugby Union Football Club Inc.,3,SA
62263,Port District Football Club,3,SA
18000,Port Lincoln Tennis Association,3,SA
44310,Port Pirie Basketball Association,3,SA
9812,Price Tennis Club,3,SA
173788,St Marys Park Sports Association Incorporated,3,SA
162890,The Adelaide Juventus Sports And Social Club,3,SA
40000,The All Boys All Girls Club Inc Trading As Queenstown Gymnastics,3,SA
190000,The Tea Tree Gully Golf Club Incorporated,3,SA
14120,Toorak Burnside Bowling Club,3,SA
409445,Town Of Gawler,3,SA
54750,West Gambier Football Club Incorporated,3,SA
192000,Brighton Council,1,TAS
385000,Devonport City Soccer Club (Dcsc),1,TAS
65238,Huon Valley Police And Community Youth Club Inc,1,TAS
112952,Kingborough Council,1,TAS
11680,Leven Yacht Club Inc.,1,TAS
50000,Meander Valley Council,1,TAS
54135,Oatlands Golf Club,1,TAS
500000,Tennis Tasmania,1,TAS
200000,Clarence City Council,2,TAS
100000,Latrobe Council,2,TAS
15500,Ouse Country Club,2,TAS
58810,Riding For The Disabled Association Kalang Inc,2,TAS
98500,Scottsdale Football Club Inc,2,TAS
32917,St Anne'S Cricket Club Inc,2,TAS
50000,Tasmanian Rugby Union,2,TAS
200000,Dover Rsl Bowls Club Inc,3,TAS
57500,Glenorchy Rodman Bowls & Community Club Inc,3,TAS
41755,Hockey Tasmania,3,TAS
11000,Newstead Tennis & Squash Centre Inc,3,TAS
337500,Tasman Council,3,TAS
101400,Trevallyn Cricket Club Inc,3,TAS
210000,Ulverstone Soccer Club,3,TAS
235000,Westbury Bowling Club,3,TAS
16000,Wynyard Golf Club,3,TAS
90000,Aspendale Tennis Club Inc,1,VIC
45000,Axedale Golf Club Inc,1,VIC
1850,Ballarat South Senior Citizens Centre Inc.,1,VIC
50000,Banyule City Council,1,VIC
370000,Barwon Heads Football And Netball Club,1,VIC
45000,Baw Baw Shire Council,1,VIC
190000,Boronia Hawks Football Netball Club Inc,1,VIC
344826,Brimbank City Council,1,VIC
170149,Cairnlea Fc Sports Club Inc.,1,VIC
10520,Camberwell Junior Football Club,1,VIC
113010,Cardinia Shire Council,1,VIC
200000,City Of Casey,1,VIC
150000,City Of Greater Bendigo,1,VIC
20000,City Of Greater Dandenong,1,VIC
20000,City Of Greater Dandenong,1,VIC
200000,Darebin City Council,1,VIC
150000,Darley Football Netball Club,1,VIC
45000,Doutta Galla Tennis Club,1,VIC
9086,East Coburg Tennis Club,1,VIC
44886,Edenhope Golf Club,1,VIC
45000,Eildon Golf Club,1,VIC
4291,Eureka Orienteers Inc,1,VIC
66000,Euroa Golf Club Inc.,1,VIC
55000,Friends Of Elcho Park Equestrian Centre,1,VIC
14000,Geelong Cement Bowls Club,1,VIC
29800,Gisborne Soccer Club,1,VIC
106000,Glen Eira,1,VIC
213675,Glen Eira,1,VIC
38500,Goulburn Valley Hockey Association,1,VIC
24182,Greensborough Tennis Club,1,VIC
5960,Hallam Tennis Club Inc,1,VIC
39000,Healesville Tennis Club Inc,1,VIC
170000,Hobsons Bay City Council,1,VIC
358590,Lakes Entrance Football Netball Club,1,VIC
163491,Langwarrin Tennis Club,1,VIC
44760,Maidstone Tennis Club,1,VIC
500000,Maroondah City Council,1,VIC
47560,Mentone Pony Club,1,VIC
50000,Montrose Tennis Club Inc,1,VIC
15260,Mordialloc Sailing Club Inc.,1,VIC
170000,Nillumbik Shire Council,1,VIC
59437,Noble Park Bowls Club,1,VIC
20000,Old Mentonians Hockey Club Inc. Trading As Mentone Hockey Club,1,VIC
500000,Pakenham Football Club,1,VIC
102572,Phillip Island District Cricket Club,1,VIC
15440,Phillip Island Tennis Club Inc,1,VIC
50000,Port Fairy Surf Life Saving Club,1,VIC
38061,Pyrenees Shire Council,1,VIC
246500,Raise The Roof Benalla Inc.,1,VIC
15726,Riddells Creek Tennis Club Incorporated,1,VIC
11900,Riding For The Disabled Viewbank,1,VIC
49274,Sanctuary Lakes Club,1,VIC
100000,Schramms Sports Club Inc,1,VIC
15000,South Camberwell Tennis Club Inc,1,VIC
31500,South Hawthorn Tennis Club,1,VIC
115000,Strathmore Sports Club,1,VIC
23000,Talbot Football Netball Club Inc.,1,VIC
50000,Yarra Ranges Shire Council,1,VIC
77241,Yarrawonga Lawn Tennis Club Incorporated,1,VIC
125000,Ballarat Golf Club,2,VIC
23076,Ballarat Lawn Tennis Club,2,VIC
179000,Berwick Bowling Club,2,VIC
50000,Bittern Tennis Club,2,VIC
38877,Blackburn Calisthenics Inc,2,VIC
42468,Boneo Tennis Club Incorporated,2,VIC
50000,Bundoora Tennis Club Inc.,2,VIC
59600,Buninyong Community Tennis Club,2,VIC
8000,Bunyip Tennis Club Inc,2,VIC
112300,Castlemaine Lawn Tennis Club,2,VIC
113556,Central Goldfields Shire Council,2,VIC
11610,Charlton Cricket Club Incorporated,2,VIC
219300,Eaglehawk Soccer Club,2,VIC
38750,East Doncaster Cricket Club,2,VIC
500000,East Shepparton Bowls Club,2,VIC
157245,Fitzroy Football Club (Incorporating The Fitzroy Reds),2,VIC
96850,Footscray Park Bowling Club,2,VIC
499000,Frankston City Council,2,VIC
19711,Frankston Dolphins Junior Football Club,2,VIC
396850,Glen Eira Amateur Football Club,2,VIC
500000,Golden Plains Shire Council,2,VIC
22000,Horsham Little Athletics Centre,2,VIC
92450,Kew Little Athletics,2,VIC
15075,Lakeside Sailing Club Pakenham,2,VIC
19907,Leitchville Bowls Club,2,VIC
50000,Leongatha And District Netball Association,2,VIC
3995,Longwarry Cricket Club,2,VIC
105000,Maroondah City Council,2,VIC
147000,Mccrae Yacht Club,2,VIC
29800,Mentone Pony Club,2,VIC
8700,Mildura West Cricket Club,2,VIC
200000,Mitchell Shire Council,2,VIC
50000,Moe Bowling Club,2,VIC
200000,Monash City Council,2,VIC
200000,Montrose Cricket Club,2,VIC
50000,Moonee Ponds Bowling Club,2,VIC
48000,Moreland City Council,2,VIC
38000,Moreland City Council,2,VIC
43231,Murrumbeena Tennis Club,2,VIC
5500,Napoleons Sebastopol Cricket Club,2,VIC
390000,Narre Warren Bowls Club Inc,2,VIC
170000,Nillumbik Shire Council,2,VIC
39085,Officer Tennis Club,2,VIC
25000,Outtrim Moyarra Kongwak Cricket Club,2,VIC
50000,Pakenham & District Golf Club,2,VIC
74755,Pakenham Upper Tennis Club,2,VIC
90000,Portarlington Golf Club,2,VIC
50000,Red Cliffs Golf Club,2,VIC
9000,Richmond Union Cricket Club,2,VIC
450000,Rowville Knights Community Football Club,2,VIC
499994,Southern Grampians Shire Council,2,VIC
53800,Southern Malle Giants Football Netball Club,2,VIC
110000,Templestowe Sporting Club,2,VIC
50000,Tennis Australia,2,VIC
200000,Towong Shire Council,2,VIC
35980,Wangaratta Clay Target Club Inc,2,VIC
50000,Warnambool Field And Game Inc,2,VIC
106800,Webbcona Bowls Club,2,VIC
250000,Wellington Shire Council,2,VIC
205360,Wodonga Football And Sports Club Inc,2,VIC
249290,Yarriambiack Shire Council,2,VIC
123648,Ashwood Sports Club,3,VIC
90940,Australian Pitch And Putt Association For Golphrobics (Waverley Pitch And Putt),3,VIC
160000,Baw Baw Shire Council,3,VIC
20000,Beaufort And District Adult Riding Club,3,VIC
49850,Burwood District Bowls Club,3,VIC
38000,Camberwell Hockey Club Inc,3,VIC
500000,Cardinia Shire Council,3,VIC
189265,Cheltenham Football Club,3,VIC
500000,City Of Ballarat,3,VIC
120775,City Of Echuca Bowls Club Inc,3,VIC
20000,City Of Greater Dandenong,3,VIC
20000,City Of Greater Dandenong,3,VIC
90000,East Camberwell Tennis Club Inc,3,VIC
500000,East Gippsland Shire Council,3,VIC
42000,Ellinbank Badminton Club Inc,3,VIC
3000,Endeavour Sporting (Soccer) Club,3,VIC
500000,Equestrian Victoria,3,VIC
34965,Footscray Park Bowling Club (Inc),3,VIC
180131,Frankston Baseball Club,3,VIC
25000,Frankston City Council,3,VIC
500000,Geelong Soccer & Sports Club,3,VIC
476558,Glen Eira City Council,3,VIC
25000,Grace Park Hawthorn Club,3,VIC
256000,Grovedale Tigers Football Netball Club,3,VIC
500000,Hawthorn Malvern Hockey Centre Pty Ltd,3,VIC
200000,Hobsons Bay City Council,3,VIC
42000,Irrewarra Cricket Club Inc,3,VIC
50000,Kawarren Recreation Reserve,3,VIC
33781,Kiewa Sandy Creek Netball Club,3,VIC
500000,Kingston City Council,3,VIC
300000,Knox City Council,3,VIC
10483,Lancefield Tennis Club,3,VIC
30000,Main Ridge Pony Club Inc,3,VIC
25000,Manningham Cobras Football Club,3,VIC
500000,Maroondah City Council,3,VIC
42140,Montmorency Junior Football Club,3,VIC
350000,Moonee Valley City Council,3,VIC
339380,Moreland City Football Club,3,VIC
245972,Mornington Peninsula Shire,3,VIC
250000,Neangar Park Golf Club Incorporated,3,VIC
200000,North Box Hill Tennis Club Inc,3,VIC
50000,North Ringwood Tennis Club,3,VIC
500000,Northern Grampians Shire Council,3,VIC
500000,Northern Grampians Shire Council,3,VIC
48400,Parkside Junior Football Club,3,VIC
50000,Preston Bullants Amateur Football Club,3,VIC
45000,Research Tennis Club,3,VIC
350000,Shire Of Strathbogie,3,VIC
172606,Somers Yacht Club Inc,3,VIC
340500,St Kilda City Junior Football Club,3,VIC
50000,St Mary'S Salesian Amateur Football Club,3,VIC
500000,Wangaratta Rural City Council,3,VIC
50000,Warranor Junior Football Club,3,VIC
127000,Winchelsea Cricket Club Inc.,3,VIC
189287,Wonthaggi Power Football Netball Club,3,VIC
500000,Yarra Ranges Shire Council,3,VIC
12350,Blue Gum Park Tennis Club,1,WA
25000,Bolgart Sports Club (Inc),1,WA
180000,Bunbury Tennis Club (Inc),1,WA
500000,City Of Armadale,1,WA
200000,City Of Canning,1,WA
90000,City Of Cockburn,1,WA
42000,City Of Joondalup,1,WA
200000,City Of Joondalup,1,WA
500000,City Of Stirling,1,WA
49986,City Of Vincent,1,WA
50000,Comet Bay Bowling Club Inc,1,WA
